<?xml version="1.0" encoding="UTF-8"?>
<package
        xmlns:xsi="http://www.w3.org/2001/XMLSchema-instance"
        xsi:noNamespaceSchemaLocation="http://apidocs.kajona.de/xsd/package.xsd"
        >
    <title>portallogin</title>
    <description>Creates a login-form on your portal-page. If enabled, users are able to change their profile-data and may request a new password (password forgotten functionality).</description>
    <version>4.3</version>
    <author>Kajona Team</author>
    <type>ELEMENT</type>
    <providesInstaller>TRUE</providesInstaller>
    <requiredModules>
        <module name="system" version="4.3" />
        <module name="pages" version="4.3" />
    </requiredModules>
</package>