<?xml version="1.0" encoding="UTF-8"?>
<package
        xmlns:xsi="http://www.w3.org/2001/XMLSchema-instance"
        xsi:noNamespaceSchemaLocation="http://apidocs.kajona.de/xsd/package.xsd"
        >
    <title>tagto</title>
    <description>A simple element embedding a "tag to service X" box to the current page, e.g. to facebook, google...</description>
    <version>4.3</version>
    <author>Kajona Team</author>
    <type>ELEMENT</type>
    <providesInstaller>TRUE</providesInstaller>
    <requiredModules>
        <module name="system" version="4.3" />
        <module name="pages" version="4.3" />
    </requiredModules>
</package>