<?xml version="1.0" encoding="UTF-8"?>
<package
        xmlns:xsi="http://www.w3.org/2001/XMLSchema-instance"
        xsi:noNamespaceSchemaLocation="http://apidocs.kajona.de/xsd/package.xsd"
        >
    <title>mediamanager</title>
    <description>
        The mediamangaer is a central place to handle all kind of files. This includes images for galleries or even a download-manager.
        If you have the package "qr-code" installed, the download links may be illustrated using a qrcode-image, too.
        The mediamanager replaces the old download- and gallery-modules.
    </description>
    <version>4.3</version>
    <author>Kajona Team</author>
    <type>MODULE</type>
    <providesInstaller>TRUE</providesInstaller>
    <requiredModules>
        <module name="system" version="4.3" />
    </requiredModules>
</package>