<?xml version="1.0" encoding="UTF-8"?>
<package
        xmlns:xsi="http://www.w3.org/2001/XMLSchema-instance"
        xsi:noNamespaceSchemaLocation="http://apidocs.kajona.de/xsd/package.xsd"
        >
    <title>portalupload</title>
    <description>Provides a way to allow users to upload their own files into the mediamanager via the portal, so without accessing the backend.</description>
    <version>4.3</version>
    <author>Kajona Team</author>
    <type>ELEMENT</type>
    <providesInstaller>TRUE</providesInstaller>
    <requiredModules>
        <module name="system" version="4.3" />
        <module name="pages" version="4.3" />
        <module name="mediamanager" version="4.3" />
    </requiredModules>
</package>