<?xml version="1.0" encoding="UTF-8"?>
<package
        xmlns:xsi="http://www.w3.org/2001/XMLSchema-instance"
        xsi:noNamespaceSchemaLocation="http://apidocs.kajona.de/xsd/package.xsd"
        >
    <title>prolific</title>
    <description>A simple but elegant template</description>
    <version>1.0</version>
    <author>Kajona Team, http://www.freecsstemplates.org/</author>
    <type>TEMPLATE</type>
    <providesInstaller>FALSE</providesInstaller>
    <requiredModules />
</package>