<?xml version="1.0" encoding="UTF-8"?>
<package
        xmlns:xsi="http://www.w3.org/2001/XMLSchema-instance"
        xsi:noNamespaceSchemaLocation="http://apidocs.kajona.de/xsd/package.xsd"
        >
    <title>languageswitch</title>
    <description>A simple element to switch the portal-language. Provides a basic logic to avoid language-switches when no content is available in other languages. Takes care of possible languagesets, e.g. for module news.</description>
    <version>4.3</version>
    <author>Kajona Team</author>
    <type>ELEMENT</type>
    <providesInstaller>TRUE</providesInstaller>
    <requiredModules>
        <module name="system" version="4.3" />
        <module name="pages" version="4.3" />
    </requiredModules>
</package>