<?xml version="1.0" encoding="UTF-8"?>
<package
        xmlns:xsi="http://www.w3.org/2001/XMLSchema-instance"
        xsi:noNamespaceSchemaLocation="http://apidocs.kajona.de/xsd/package.xsd"
        >
    <title>pages</title>
    <description>Pages are the central part of the system. A page is rendered in the portal and contains several page elements, such as paragraphs, tables or even galleries. The layout is based on the integrated template-engine-</description>
    <version>4.3</version>
    <author>Kajona Team</author>
    <type>MODULE</type>
    <providesInstaller>TRUE</providesInstaller>
    <requiredModules>
        <module name="system" version="4.3" />
        <module name="mediamanager" version="4.3" />
    </requiredModules>
</package>