<?xml version="1.0" encoding="UTF-8"?>
<package
        xmlns:xsi="http://www.w3.org/2001/XMLSchema-instance"
        xsi:noNamespaceSchemaLocation="http://apidocs.kajona.de/xsd/package.xsd"
        >
    <title>search</title>
    <description>The module search provides a full-text search for both, backend and portal. It respects permissions and status of all records.</description>
    <version>4.3</version>
    <author>Kajona Team</author>
    <type>MODULE</type>
    <providesInstaller>TRUE</providesInstaller>
    <requiredModules>
        <module name="system" version="4.3" />
    </requiredModules>
</package>