<?xml version="1.0" encoding="UTF-8"?>
<package
        xmlns:xsi="http://www.w3.org/2001/XMLSchema-instance"
        xsi:noNamespaceSchemaLocation="http://apidocs.kajona.de/xsd/package.xsd"
    >
    <title>eventmanager</title>
    <description>A module to organize events and its participants. Participants may register to events, the number of participants per event is configurable.</description>
    <version>4.3</version>
    <author>Kajona Team</author>
    <type>MODULE</type>
    <providesInstaller>TRUE</providesInstaller>
    <requiredModules>
        <module name="system" version="4.3" />
        <module name="pages" version="4.3" />
    </requiredModules>
</package>