<?xml version="1.0" encoding="UTF-8"?>
<package
        xmlns:xsi="http://www.w3.org/2001/XMLSchema-instance"
        xsi:noNamespaceSchemaLocation="http://apidocs.kajona.de/xsd/package.xsd"
        >
    <title>stats</title>
    <description>A module analyzing the portal in order to gather statistical data. Renderes charts and other visual reports.</description>
    <version>4.3</version>
    <author>Kajona Team</author>
    <type>MODULE</type>
    <providesInstaller>TRUE</providesInstaller>
    <requiredModules>
        <module name="system" version="4.3" />
        <module name="jqplot" version="4.3" />
    </requiredModules>
</package>