<?xml version="1.0" encoding="UTF-8"?>
<package
        xmlns:xsi="http://www.w3.org/2001/XMLSchema-instance"
        xsi:noNamespaceSchemaLocation="http://apidocs.kajona.de/xsd/package.xsd"
        >
    <title>form</title>
    <description>A simple element providing a contact form. May be used to develop other forms, too.</description>
    <version>4.3</version>
    <author>Kajona Team</author>
    <target>element_formular</target>
    <type>ELEMENT</type>
    <providesInstaller>TRUE</providesInstaller>
    <requiredModules>
        <module name="system" version="4.3" />
        <module name="pages" version="4.3" />
    </requiredModules>
</package>