<?xml version="1.0" encoding="UTF-8"?>
<package
        xmlns:xsi="http://www.w3.org/2001/XMLSchema-instance"
        xsi:noNamespaceSchemaLocation="http://apidocs.kajona.de/xsd/package.xsd"
        >
    <title>qrcode</title>
    <description>QR Codes may be used to generate images containing text-information such as links.</description>
    <version>4.3</version>
    <author>Kajona Team</author>
    <type>MODULE</type>
    <providesInstaller>FALSE</providesInstaller>
    <requiredModules>
        <module name="system" version="4.3" />
    </requiredModules>
</package>